{
  "id": "sapui5-docs-03-get-started-step-26-mock-server-configuration-typescript-3e1c64f-md",
  "title": "Step 26: Mock Server Configuration \\(TypeScript\\)",
  "category": "ui5-framework",
  "path": "docs/03_Get-Started/step-26-mock-server-configuration-typescript-3e1c64f.md",
  "lastModified": "2025-09-01T18:17:10.464Z",
  "tags": [
    "ui5-framework",
    "md",
    "Step",
    "Mock",
    "Server",
    "Configuration",
    "TypeScript"
  ],
  "headers": [
    "Step 26: Mock Server Configuration \\(TypeScript\\)",
    "Preview",
    "Coding",
    "webapp/localService/metadata.xml \\(New\\)",
    "webapp/localService/mockdata/Invoices.json \\(New\\)",
    "webapp/localService/mockserver.ts \\(New\\)",
    "webapp/test/initMockServer.ts \\(New\\)",
    "webapp/test/mockServer.html \\(New\\)",
    "package.json",
    "Conventions"
  ],
  "content": "<!-- loio3e1c64fd34e247afaf468a92414ed722 -->\n\n# Step 26: Mock Server Configuration \\(TypeScript\\)\n\nWe just ran our app against a real service, but for developing and testing our app we do not want to rely on the availability of the \"real\" service or put additional load on the system where the data service is located.\n\nThis system is the so-called back-end system that we will now simulate with an SAPUI5 feature called mock server. It serves local files, but it simulates a back-end system more realistically than just loading the local data. We will also change the model instantiation part so that the model is configured in the descriptor and instantiated automatically by SAPUI5. This way, we do not need to take care of the model instantiation in the code.\n\n\n\n## Preview\n\n  \n  \n**The list of invoices is now served by the Mock Server**\n\n![The graphic has an explanatory text.](images/UI5_Walkthrough_Step_26_fe14033.png \"The list of invoices is now served by the Mock Server\")\n\n\n\n## Coding\n\nYou can view all files at [OpenUI5 TypeScript Walkthrough - Step 26: Mock Server Configuration](https://github.com/sap-samples/ui5-typescript-walkthrough/tree/main/steps/26) and [download the solution as a zip file](https://sap-samples.github.io/ui5-typescript-walkthrough/ui5-typescript-walkthrough-step-26.zip).\n\n  \n  \n**Folder Structure for this Step**\n\n![The graphic has an explanatory text](images/UI5_Walkthrough_TypeScript_Folders_Step_26_0ed1999.png \"Folder Structure for this Step\")\n\nThe folder structure of our app project is clearly separating test and productive files after this step. The new `test` folder now contains a new HTML page `mockServer.html` which will launch our application in test mode without calling the real service.\n\nThe new `localService` folder contains a `metadata.xml` service description file for OData, the `mockserver.js` file that simulates a real service with local data, and the `mockdata` subfolder that contains the local test data \\(`Invoices.json`\\).\n\n\n\n<a name=\"loio3e1c64fd34e247afaf468a92414ed722__section_yfy_x11_4zb\"/>\n\n## webapp/localService/metadata.xml \\(New\\)\n\nWe create a new `localService` folder in the `webapp` folder and add a new `metadata.xml` file to it.\n\nThe metadata file contains information about the service interface and does not need to be written manually. It can be accessed directly from the \"real\" service by calling the service URL and adding `$metadata` at the end \\(e.g. in our case `http://services.odata.org/V2/Northwind/Northwind.svc/$metadata`\\).\n\nFor simplicity, we remove all content from the original Northwind OData metadata document that we do not need in our scenario. We also added the `status` field to the metadata, since it is not available in the real Northwind service.\n\n```xml\n<edmx:Edmx Version=\"1.0\" xmlns:edmx=\"http://schemas.microsoft.com/ado/2007/06/edmx\">\n\t<edmx:DataServices m:DataServiceVersion=\"1.0\" m:MaxDataServiceVersion=\"3.0\"\n\t\t\txmlns:m=\"http://schemas.microsoft.com/ado/2007/08/dataservices/metadata\">\n\t\t<Schema Namespace=\"NorthwindModel\" xmlns=\"http://schemas.microsoft.com/ado/2008/09/edm\">\n\t\t\t<EntityType Name=\"Invoice\">\n\t\t\t\t<Key>\n\t\t\t\t\t<PropertyRef Name=\"ProductName\"/>\n\t\t\t\t\t<PropertyRef Name=\"Quantity\"/>\n\t\t\t\t\t<PropertyRef Name=\"ShipperName\"/>\n\t\t\t\t</Key>\n\t\t\t\t<Property Name=\"ShipperName\" Type=\"Edm.String\" Nullable=\"false\" MaxLength=\"40\" FixedLength=\"false\"\n\t\t\t\t\t\t\tUnicode=\"true\"/>\n\t\t\t\t<Property Name=\"ProductName\" Type=\"Edm.String\" Nullable=\"false\" MaxLength=\"40\" FixedLength=\"false\"\n\t\t\t\t\t\t\tUnicode=\"true\"/>\n\t\t\t\t<Property Name=\"Quantity\" Type=\"Edm.Int16\" Nullable=\"false\"/>\n\t\t\t\t<Property Name=\"ExtendedPrice\" Type=\"Edm.Decimal\" Precision=\"19\" Scale=\"4\"/>\n\t\t\t\t<Property Name=\"Status\" Type=\"Edm.String\" Nullable=\"false\" MaxLength=\"1\" FixedLength=\"false\"\n\t\t\t\t\t\t\tUnicode=\"true\"/>\n\t\t\t</EntityType>\n\t\t</Schema>\n\t\t<Schema Namespace=\"ODataWebV2.Northwind.Model\" xmlns=\"http://schemas.microsoft.com/ado/2008/09/edm\">\n\t\t\t<EntityContainer Name=\"NorthwindEntities\" m:IsDefaultEntityContainer=\"true\" p6:LazyLoadingEnabled=\"true\"\n\t\t\t\t\txmlns:p6=\"http://schemas.microsoft.com/ado/2009/02/edm/annotation\">\n\t\t\t\t<EntitySet Name=\"Invoices\" EntityType=\"NorthwindModel.Invoice\"/>\n\t\t\t</EntityContainer>\n\t\t</Schema>\n\t</edmx:DataServices>\n</edmx:Edmx>\n\n```\n\n\n\n<a name=\"loio3e1c64fd34e247afaf468a92414ed722__section_s2p_mb1_4zb\"/>\n\n## webapp/localService/mockdata/Invoices.json \\(New\\)\n\nInside the `localService` folder, we create the new folder `mockdata`. The mock server determines the local source files with the appriopriate mock data by matching the entity set names defined in the `metadata.xml` file with the local source file names. As we want to simulate data specified in the metadata file in the entity set `Invoices`, we have to name our mockdata file `Invoices.json`.\n\nWe add the new file `Invoices.json` to our new folder and define one flat array with the following invoice items:\n\n```\n[\n  {\n\t\"ProductName\": \"Pineapple\",\n\t\"Quantity\": 21,\n\t\"ExtendedPrice\": 87.2,\n\t\"ShipperName\": \"Fun Inc.\",\n\t\"ShippedDate\": \"2015-04-01T00:00:00\",\n\t\"Status\": \"A\"\n  },\n  {\n\t\"ProductName\": \"Milk\",\n\t\"Quantity\": 4,\n\t\"ExtendedPrice\": 10,\n\t\"ShipperName\": \"ACME\",\n\t\"ShippedDate\": \"2015-02-18T00:00:00\",\n\t\"Status\": \"B\"\n  },\n  {\n\t\"ProductName\": \"Canned Beans\",\n\t\"Quantity\": 3,\n\t\"ExtendedPrice\": 6.85,\n\t\"ShipperName\": \"ACME\",\n\t\"ShippedDate\": \"2015-03-02T00:00:00\",\n\t\"Status\": \"B\"\n  },\n  {\n\t\"ProductName\": \"Salad\",\n\t\"Quantity\": 2,\n\t\"ExtendedPrice\": 8.8,\n\t\"ShipperName\": \"ACME\",\n\t\"ShippedDate\": \"2015-04-12T00:00:00\",\n\t\"Status\": \"C\"\n  },\n  {\n\t\"ProductName\": \"Bread\",\n\t\"Quantity\": 1,\n\t\"ExtendedPrice\": 2.71,\n\t\"ShipperName\": \"Fun Inc.\",\n\t\"ShippedDate\": \"2015-01-27T00:00:00\",\n\t\"Status\": \"A\"\n  }\n]\n```\n\n\n\n<a name=\"loio3e1c64fd34e247afaf468a92414ed722__section_ddh_dc1_4zb\"/>\n\n## webapp/localService/mockserver.ts \\(New\\)\n\nNow we can write the code to initialize the mock server, which will then simulate any OData request to the real Northwind server. For this we add a new file `mockserver.ts` to the `localService` folder.\n\nWe import the standard SAPUI5 `MockServer` module and create a helper object that defines an `init` method to start the server. The `init` method creates a `MockServer` instance with the same URL as the real service calls. The URL in the `rootUri` configuration parameter has to point to the same URL as defined in the `uri` property of the data source in the `manifest.json` descriptor file. In the `manifest.json`, SAPUI5 automatically interprets a relative URL as being relative to the application namespace. In the TypeScript code, you can ensure this by using the `sap.ui.require.toUrl` method. The `sap/ui/core/util/MockServer` then catches every request to the real service and returns a response.\n\nNext, we set two global configuration settings that tell the server to respond automatically and introduce a delay of 500 ms to imitate a typical server response time. Otherwise, we would have to call the respond method on the `MockServer` manually to simulate the call. The delay can be specified with the URI parameter `serverDelay`.\n\nTo simulate a service, we can simply call the `simulate` method on the `MockServer` instance with the path to our newly created `metadata.xml`. This will read the test data from our local file system and set up the URL patterns that will mimic the real service.\n\nFinally, we call the `start` method on the mock server. From this point, each request to the URL pattern `rootUri` will be processed by the mock server.\n\n```js\nimport MockServer from \"sap/ui/core/util/MockServer\";\n\t\t\t\t\nexport default {\n\n    init: function () {\n        // create\n        const mockServer = new MockServer({\n            rootUri: sap.ui.require.toUrl(\"ui5/walkthrough/V2/Northwind/Northwind.svc/\")\n        });\n\n        const urlParams = new URLSearchParams(window.location.search);\n\n        // configure mock server with a delay\n        MockServer.config({\n            autoRespond: true,\n            autoRespondAfter: parseInt(urlParams.get(\"serverDelay\") || \"500\")\n        });\n\n        // simulate\n        const path = sap.ui.require.toUrl(\"ui5/walkthrough/localService\");\n        mockServer.simulate(path + \"/metadata.xml\", path + \"/mockdata\");\n\n        // start\n        mockServer.start();\n    }\n};\n```\n\n\n\n<a name=\"loio3e1c64fd34e247afaf468a92414ed722__section_oxn_5zr_yfb\"/>\n\n## webapp/test/initMockServer.ts \\(New\\)\n\nAs a next step, we create a module that initializes our local mock server. For this, we add the new `test` folder to our `webapp` folder where we place the new `initMockServer.ts` file.\n\nFirst, we call the `init` method of our local mock server, then we initialize the app component.\n\n```js\nimport mockserver from \"../localService/mockserver\";\n\n// initialize the mock server\nmockserver.init();\n\n// initialize the embedded component on the HTML page\nimport(\"sap/ui/core/ComponentSupport\");\n```\n\n\n\n## webapp/test/mockServer.html \\(New\\)\n\nFinally we create a new `mockServer.html` page in our `test` folder. We will use this file to run our app in test mode with our mock server loading mock data from out local `Invoices` JSON file. Test pages should not be placed in the application root folder but in a subfolder called `test` to clearly separate productive and test coding.\n\nWe copy the content of the `index.html` file to it and change the page title to distinguish it from the productive start page. We also need to change the `data-sap-ui-resource-roots` property. The namespace now points to the folder above \\(\\`\"../\"\\`\\), because the `mockServer.html` file is in a subfolder of the `webapp` folder. Also the bootstrap script to the SAPUI5 core library needs to be adapted this way.\n\nWe define that the HTML page now initializes the `initMockServer` module instead of the app component.\n\n```html\n<!DOCTYPE html>\n<html>\n<head>\n\t<meta charset=\"utf-8\">\n\t<title>SAPUI5 UI5 Walkthrough - Mockserver Test Page</title>\n\t<script\n\t\tid=\"sap-ui-bootstrap\"\n\t\tsrc=\"../resources/sap-ui-core.js\"\n\t\tdata-sap-ui-theme=\"sap_horizon\"\n\t\tdata-sap-ui-compat-version=\"edge\"\n\t\tdata-sap-ui-async=\"true\"\n\t\tdata-sap-ui-on-init=\"module:ui5/walkthrough/test/initMockServer\"\n\t\tdata-sap-ui-resource-roots='{\n\t\t\t\"ui5.walkthrough\": \"../\"\n\t\t}'>\n\t</script>\n</head>\n<body class=\"sapUiBody\" id=\"content\">\n\t<div data-sap-ui-component data-name=\"ui5.walkthrough\" data-id=\"container\" data-settings='{\"id\" : \"walkthrough\"}'></div>\n\n</body>\n</html>\n```\n\nWhen launching the app with the `mockServer.html` file, the `initMockServer` module is called, which first initializes our local mock server and only then our app component. This way we catch all requests that would go to the \"real\" service and process them locally by our mock server instead. The component itself does not \"know\" that it now runs in test mode.\n\nIf you switch from the `index.html` file to the `mockServer.html` file in the browser, you can now see that the test data is displayed from the local sources, but with a short delay as defined in our local mock server configuration.\n\nThis approach is perfect for local testing, even without any network connection. This way your development does not depend on the availability of a remote server, i.e. to run your tests.\n\nFrom this point on, you have two different entry pages: One for the real \"connected\" app \\(`index.html`\\) and one for local testing \\(`mockServer.html`\\). You can freely decide if you want to do the next steps on the real service data or on the local data within the app. Try calling the app with the `index.html` file and the `mockServer.html` file to see the difference. If the real service connection cannot be made, for example when there is no network connection, you can always fall back to the local test page.\n\n\n\n<a name=\"loio3e1c64fd34e247afaf468a92414ed722__section_lfx_4dg_tyb\"/>\n\n## package.json\n\nIf you prefer to continue with the local data, you should adjust the `start` script in the `package.json` to open `mockServer.html` instead of `index.html`:\n\n```\n{\n  \"name\": \"ui5.walkthrough\",\n  \"version\": \"1.0.0\",\n  \"description\": \"UI5 TypeScript Walkthrough\",\n  \"scripts\": {\n      \"start\": \"ui5 serve -o test/mockServer.html\"\n  },\n  \"devDependencies\": {    \n    \"@types/openui5\": \"^1.120.0\",\n    \"@ui5/cli\": \"^3.7.1\",\n    \"typescript\": \"^5.2.2\",\t\n    \"ui5-middleware-livereload\": \"^3.0.2\",\n    \"ui5-middleware-serveframework\": \"3.0.0\",\n    \"ui5-middleware-simpleproxy\": \"^3.2.8\",\n    \"ui5-tooling-transpile\": \"^3.2.7\"\n  }\n}\n```\n\n\n\n## Conventions\n\n-   The `webapp/test` folder contains non-productive code only.\n\n-   Mock data and the script to start the `MockServer` are stored in the `webapp/localService` folder.\n\n-   The script to start the `MockServer` is called `mockserver.js`.\n\n\n**Related Information**  \n\n\n[Mock Server](../04_Essentials/mock-server-69d3cbd.md \"A mock server mimics one or more back-end services. It is used to simplify integration testing and to decouple UI development from service development. By using a mock server you can develop and test the UI even if the service in the back end is incomplete or unstable.\")\n\n[API Reference: `sap.ui.core.util.MockServer`](https://ui5.sap.com/#/api/sap.ui.core.util.MockServer)\n\n[Create a Northwind Destination](../05_Developing_Apps/create-a-northwind-destination-3a16c7a.md \"Configure a destination in the SAP BTP Cockpit in order to bypass the same-origin policy of the browser.\")\n\n",
  "excerpt": "<!-- loio3e1c64fd34e247afaf468a92414ed722 --> Step 26: Mock Server Configuration \\(TypeScript\\) We just ran our app against a real service, but for developing and testing our app we do not want to rel...",
  "wordCount": 1615,
  "version": "1.0.0",
  "source": "sapui5",
  "sourceType": "github"
}