{
  "id": "fiori-samples-sample-fiori-gen-ext-package-json",
  "title": "@sample/fiori-gen-ext",
  "category": "fiori-samples",
  "path": "sample-fiori-gen-ext/package.json",
  "lastModified": "2025-09-29T10:06:39.532Z",
  "tags": [
    "fiori-samples",
    "json",
    "package"
  ],
  "headers": [
    "name",
    "version",
    "description",
    "keywords",
    "repository",
    "license",
    "author",
    "main",
    "files",
    "scripts"
  ],
  "content": "# package.json\n\n```json\n{\n  \"name\": \"@sample/fiori-gen-ext\",\n  \"version\": \"0.2.0\",\n  \"description\": \"Sample Fiori generator extension sub-generator\",\n  \"keywords\": [\n    \"fiori-generator-extension\"\n  ],\n  \"repository\": {\n    \"type\": \"git\",\n    \"url\": \"https://github.com/SAP-samples/fiori-tools-samples\"\n  },\n  \"license\": \"none\",\n  \"author\": \"\",\n  \"main\": \"generators\",\n  \"files\": [\n    \"generators\"\n  ],\n  \"scripts\": {\n    \"build\": \"tsc --build\",\n    \"bundle\": \"npm run clean && esbuild src/index.ts --outfile=generators/index.js --bundle --external:@sap/generator-fiori --external:node-gyp/bin/node-gyp.js --external:shelljs --platform=node\",\n    \"clean\": \"rimraf ./generators\"\n  },\n  \"dependencies\": {\n    \"node-gyp\": \"10.0.1\",\n    \"shelljs\": \"0.8.5\"\n  },\n  \"devDependencies\": {\n    \"@sap-devx/yeoman-ui-types\": \"1.14.0\",\n    \"@sap/generator-fiori\": \"^1.14.1\",\n    \"@sap-ux/ui5-application-inquirer\": \"0.5.6\",\n    \"@types/yeoman-generator\": \"5.2.14\",\n    \"esbuild\": \"0.17.19\",\n    \"rimraf\": \"5.0.0\",\n    \"typescript\": \"4.9.4\",\n    \"yeoman-generator\": \"5.10.0\"\n  },\n  \"peerDependencies\": {\n    \"@sap/generator-fiori\": \"^1.14.1\"\n  },\n  \"engines\": {\n    \"node\": \">=16 <17 || >=18 <19 || >=20\"\n  }\n}\n```",
  "excerpt": "package.json",
  "wordCount": 101,
  "version": "1.0.0",
  "source": "fiori-samples",
  "sourceType": "github"
}