{
  "id": "sapui5-inline-edit-bb56175-md",
  "title": "Inline Edit",
  "category": "fiori-elements-framework",
  "path": "inline-edit-bb56175.md",
  "lastModified": "2025-09-29T10:06:38.837Z",
  "tags": [
    "fiori-elements-framework",
    "md",
    "inline",
    "edit",
    "bb56175"
  ],
  "headers": [
    "Inline Edit",
    "Inline Editing a Field",
    "Error Management",
    "Action Execution and Navigation",
    "Configuring Inline Edit",
    "Back-End Configuration"
  ],
  "content": "<!-- loiobb56175f37aa4530a59214025a005466 -->\n\n<link rel=\"stylesheet\" type=\"text/css\" href=\"../css/sap-icons.css\"/>\n\n# Inline Edit\n\nInline editing allows users to edit specific fields or field groups without switching the entire object to draft.\n\nSAP Fiori elements for OData V4 supports inline edit in the list report and on the object page as of SAPUI5 1.136. With this feature, users can directly edit a field or a group of fields in the active version without switching the entire object to draft. Inline edit supports the same features as the regular edit mode.\n\n> ### Note:  \n> This topic is only applicable to SAP Fiori elements for OData V4.\n\nInline edit is supported on pages based on the `sap.fe.templates.ListReport` or `sap.fe.templates.ObjectPage` templates with a draft-enabled service. Inline edit is also supported with building blocks when they are used within these templates.\n\n> ### Restriction:  \n> Inline edit isn't supported in the following cases:\n> \n> -   Collaborative draft is enabled in the application.\n> \n> -   The application uses the flexible column layout.\n> \n> -   The field is a stream property field or a multi-input field.\n\n\n\n<a name=\"loiobb56175f37aa4530a59214025a005466__section_p1m_22y_ffc\"/>\n\n## Inline Editing a Field\n\nWhen hovering, fields that can be edited inline are underlined, and an *Edit* button is shown. The inline edit indicators are shown if the field is editable and the inline edit functionality is available for it. For more information about configuring inline editable fields, see the [Configuring Inline Edit](inline-edit-bb56175.md#loiobb56175f37aa4530a59214025a005466__configuring_inline_edit) section in this topic.\n\n  \n  \n**Inline Edit Indicators**\n\n![](images/Inline_Edit_Indicators_5dec6b1.png \"Inline Edit Indicators\")\n\nTo edit a field, the user must click the :pencil2: \\(*Edit*\\) icon or double-click the field. The user can also press [Enter\\] if the field is focused.\n\n> ### Note:  \n> -   Double-click is not supported for responsive tables.\n> \n> -   Inline edit isn't available if the object already has a draft.\n\nDepending on the type of field, the inline edit provides the same features that are available in the regular edit mode, such as recently used values, date and time selection, and value help.\n\n  \n  \n**Inline Editing a Field**\n\n![](images/Inline_Editing_a_Field_24c44a4.png \"Inline Editing a Field\")\n\nIf the field belongs to a group of connected fields, all fields within the group are switched to edit.\n\n  \n  \n**Inline Editing a Field Group**\n\n![](images/Inline_Editing_a_Field_Group_644bea3.png \"Inline Editing a Field Group\")\n\nAfter entering a new value, the user can do the following:\n\n-   Validate the changes by clicking the :heavy_check_mark: \\(*Save*\\) icon or pressing [Enter\\]\n\n-   Cancel by clicking the :x: \\(*Cancel*\\) icon or pressing [Esc\\]\n\n\nWhen validating an entry, the active version of the object is directly updated, and no draft is created. For a group of connected fields, the changes in all fields are made with a single request.\n\n\n\n<a name=\"loiobb56175f37aa4530a59214025a005466__section_hcq_mhy_ffc\"/>\n\n## Error Management\n\nIf an error occurs when submitting an inline edit change, a message button is shown in the footer of the page. The changed fields and the fields related to the error are displayed in edit mode so the user can make the required changes. If a field related to the error is part of a group of connected fields, all the fields of the group are displayed in edit mode. The following screenshot shows an example where a change in the *Description* field causes an error in the *Starting Date* field. *Starting Date* is grouped with *End Date*, so both fields are displayed in edit mode:\n\n  \n  \n**Error Caused by Inline Editing**\n\n![](images/Error_Caused_by_Inline_Editing_43ead48.png \"Error Caused by Inline Editing\")\n\nIf the error references a field not displayed on the page, the issue can't be fixed by inline editing, and the user must switch the object to edit mode to make the changes.\n\n\n\n<a name=\"loiobb56175f37aa4530a59214025a005466__section_egw_why_ffc\"/>\n\n## Action Execution and Navigation\n\nIf a user triggers an action when inline editing, a prompt is shown to save or discard the ongoing change. After choosing an option, the user must re-execute the action.\n\n  \n  \n**Prompt to Save or Discard Changes \\(Action\\)**\n\n![](images/Prompt_to_Save_or_Discard_Changes_b8b7a68.png \"Prompt to Save or Discard Changes (Action)\")\n\nIf the user triggers navigation from a table when inline editing, a prompt is also shown to save or discard the change. After choosing an option, the navigation occurs.\n\n  \n  \n**Prompt to Save or Discard Changes \\(Navigation\\)**\n\n![](images/Prompt_to_Save_or_Discard_Changes_Navigation_a6b0edd.png \"Prompt to Save or Discard Changes (Navigation)\")\n\n> ### Note:  \n> When navigation is triggered from the browser's navigation icons, the FLP header, or through an intent-based navigation, the navigation occurs and the current change is lost.\n\n\n\n<a name=\"loiobb56175f37aa4530a59214025a005466__configuring_inline_edit\"/>\n\n## Configuring Inline Edit\n\nYou must enable inline edit at the page level using a manifest setting. To specify the list of fields enabled for inline edit, use the `enableFields` parameter with either a property name or a `FieldGroup` annotation. To disable inline editing for certain fields, use the `disableFields` parameter with either a property name or a `FieldGroup` annotation. If `disableFields` is empty, inline editing is enabled for all fields.\n\nYou can also specify groups of connected fields which should be edited together. To do that, use the `connectedFields` parameter with either arrays of property names or `FieldGroup` annotations.\n\n> ### Tip:  \n> Immediate side effects aren't supported within a group of connected fields. If a side effect has a source property A and a target property B where both A and B belong to the same group of connected fields, this side effect is not triggered when property A is changed.\n\n**Example 1: All Fields Are Enabled for Inline Edit in the List Report**\n\n> ### Sample Code:  \n> `manifest.json`\n> \n> ```\n> \"TravelList\": {\n>     \"type\": \"Component\",\n>     \"name\": \"sap.fe.templates.ListReport\",\n>     \"id\": \"TravelList\",\n>     \"options\": {\n>         \"settings\": {\n>             \"inlineEdit\": {\n>                 \"disabledFields\": []\n>             },\n>             \"contextPath\": \"/Travel\",\n>             \"initialLoad\": \"Enabled\",\n>             \"navigation\": {\n>                 \"Travel\": {\n>                     \"detail\": {\n>                         \"route\": \"TravelObjectPage\"\n>                     }\n>                 }\n>             }\n>         }\n>     }\n> }\n> ```\n\n**Example 2: Four Fields Are Enabled for Inline Edit, and One Group of Connected Fields Is Defined**\n\n> ### Sample Code:  \n> `manifest.json`\n> \n> ```\n> \"TravelList\": {\n>     \"type\": \"Component\",\n>     \"name\": \"sap.fe.templates.ListReport\",\n>     \"id\": \"TravelList\",\n>     \"options\": {\n>         \"settings\": {\n>             \"inlineEdit\": {\n>                 \"enabledFields\": [\"to_Customer_CustomerID\", \"BeginDate\",\"EndDate\", \"BookingFee\"],\n>                 \"connectedFields\": [[\"BeginDate\", \"EndDate\"]]\n>             },\n>             \"contextPath\": \"/Travel\",\n>             \"initialLoad\": \"Enabled\",\n>             \"navigation\": {\n>                 \"Travel\": {\n>                     \"detail\": {\n>                         \"route\": \"TravelObjectPage\"\n>                     }\n>                 }\n>             }\n>         }\n>     }\n> }\n> ```\n\n**Example 3: Fields Within a Table in an Object Page Form Are Enabled Using Field Groups, and Connected Fields Are Defined Using an Array of Properties and a `FieldGroup` Annotation**\n\n> ### Sample Code:  \n> `manifest.json`\n> \n> ```\n> \"TravelObjectPage\": {\n>     \"type\": \"Component\",\n>     \"id\": \"TravelObjectPage\",\n>     \"name\": \"sap.fe.templates.ObjectPage\",\n>     \"options\": {\n>         \"settings\": {\n>             \"entitySet\": \"Travel\",\n>             \"inlineEdit\": {\n>                \"enabledFields\": [\"@com.sap.vocabularies.UI.v1.FieldGroup#TripData\", \"to_Booking/@com.sap.vocabularies.UI.v1.FieldGroup#Flight\"],\n>                 \"connectedFields\": [\n>                     [\"BeginDate\", \"EndDate\"],\n>                     \"to_Booking/@com.sap.vocabularies.UI.v1.FieldGroup#Flight\"\n>                 ]\n>             }\n>         }\n>     }\n> }\n> ```\n\n\n\n<a name=\"loiobb56175f37aa4530a59214025a005466__section_ll2_cpy_ffc\"/>\n\n## Back-End Configuration\n\nWhen using inline edit, the active version of the object is patched directly, so no draft is created.\n\nWhen using ABAP, you must follow the implementation recommendations for business objects. For more information, see [ABAP RESTful Application Programming Model](https://help.sap.com/docs/abap-cloud/abap-rap/abap-restful-application-programming-model).\n\nWhen using CAP, you must ensure that the option to bypass the draft is set correctly. For more information about CAP Node.js, see the [Bypassing the SAP Fiori Draft Flow](https://cap.cloud.sap/docs/node.js/fiori#bypassing-the-sap-fiori-draft-flow) section in [Fiori Support](https://cap.cloud.sap/docs/node.js/fiori). For more information about CAP Java, see the [Bypassing the SAP Fiori Draft Flow](https://cap.cloud.sap/docs/java/fiori-drafts#bypassing-draft-flow) section in [Fiori Drafts](https://cap.cloud.sap/docs/java/fiori-drafts).\n\n",
  "excerpt": "<!-- loiobb56175f37aa4530a59214025a005466 --> <link rel=\"stylesheet\" type=\"text/css\" href=\"../css/sap-icons.css\"/> Inline Edit Inline editing allows users to edit specific fields or field groups witho...",
  "wordCount": 1232,
  "version": "1.0.0",
  "source": "sapui5",
  "sourceType": "github"
}