{
  "id": "sapui5-tree-tables-7cf7a31-md",
  "title": "Tree Tables",
  "category": "fiori-elements-framework",
  "path": "tree-tables-7cf7a31.md",
  "lastModified": "2025-09-29T10:06:38.868Z",
  "tags": [
    "fiori-elements-framework",
    "md",
    "tree",
    "tables",
    "7cf7a31"
  ],
  "headers": [
    "Tree Tables",
    "Enabling Tree Tables",
    "Create Mode and Custom Create Mode with a Menu Button",
    "Custom Create Mode with a Create Dialog",
    "Enabling or Disabling the Create Button or the Create Menu Button",
    "Create at a Position Calculated by the Back-End Server",
    "Drag and Drop",
    "Move Up and Move Down",
    "Cut and Paste",
    "Copy and Paste",
    "Context Menu",
    "Disabling Hierarchy Change Operations",
    "Disabling the Reordering of Root Nodes",
    "`TreeTable` Building Block"
  ],
  "content": "<!-- loio7cf7a31fd1ee490ab816ecd941bd2f1f -->\n\n# Tree Tables\n\nYou can use tree tables in the list report and the object page.\n\n> ### Note:  \n> This topic is only applicable to SAP Fiori elements for OData V4.\n\nSAP Fiori elements for OData V4 supports displaying a tree table on the list report with a draft-enabled service with the following behavior:\n\n-   Only the active entities are displayed.\n\n-   The *Editing Status* field is not displayed in the filter bar.\n\n-   The draft indicator is shown if a draft exists for an active record.\n\n-   When creating a new object, the new object needs to be saved or discarded.\n\n-   The behavior of already saved objects remains unchanged: a draft can be saved, kept, or discarded. The navigation is also unchanged.\n\n-   Extension points are the same as for the object page.\n\n\n> ### Note:  \n> When switching between edit mode and display mode, the expansion state of a tree table in an object page is not kept.\n\n> ### Restriction:  \n> A tree table cannot be displayed on the list report with a draft-enabled service in the flexible column layout.\n\n\n\n<a name=\"loio7cf7a31fd1ee490ab816ecd941bd2f1f__section_kmb_mld_gbc\"/>\n\n## Enabling Tree Tables\n\nTo enable tree tables in the list report or object page, the following parameters are needed in the `tableSettings` part of the `manifest.json`:\n\n-   Set the `type` to `TreeTable`.\n\n-   Set the `hierarchyQualifier`. You must use the qualifier for the `Hierarchy.RecursiveHierarchy` annotation for the page entity set.\n\n\n> ### Sample Code:  \n> `manifest.json`\n> \n> ```json\n> \"tableSettings\": {\n>      \"type\": \"TreeTable\",\n>      \"hierarchyQualifier\": \"NodesHierarchy\",\n>    ...\n> }\n> ```\n\n\n\n<a name=\"loio7cf7a31fd1ee490ab816ecd941bd2f1f__section_osy_44d_gbc\"/>\n\n## Create Mode and Custom Create Mode with a Menu Button\n\nThe following creation modes are supported with a tree table:\n\n-   `Inline`\n\n-   `NewPage`\n\n-   `CreationDialog`\n\n\nIn the list report, only the `NewPage` \\(default\\) creation mode and the `CreationDialog` creation mode are supported.\n\nSAP Fiori elements for OData V4 supports the default create mode as well as a custom create mode. To use the custom create mode, add the following annotations to the `nodeType` section:\n\n-   `propertyName`: Name of the property on the page entity set used to categorize the node type to be created within the hierarchy.\n\n-   `values`: An object containing the values of the `propertyName` and the corresponding label to be used in the menu:\n\n    -   `value`: A value of the property defined by the `propertyName` key.\n\n    -   `label`: The menu item label that can be localized using an `i18n` key.\n\n    -   `creationFields`: The properties to be displayed when using the `CreationDialog` mode. The `creationFields` parameter can point to a `FieldGroup` annotation or a comma-separated list of properties.\n\n\n\n> ### Sample Code:  \n> Custom Create Mode Options in the Tree Table\n> \n> ```json\n> \"tableSettings\": {\n>     \"type\": \"TreeTable\",\n>     \"hierarchyQualifier\": \"NodesHierarchy\",\n>     \"personalization\": true,\n>     \"creationMode\": {\n>          \"name\": \"Inline\",\n>          \"nodeType\": {\n>             \"propertyName\": \"nodeType\",\n>             \"values\": {\n>                 \"Zone\": \"Create a new Zone\",\n>                 \"Intermediary\": \"Create a new Intermediary node\",\n>                 \"Line\": \"Create a new Line item\"\n>              }\n>          },\n>          \"isCreateEnabled\": \".extension.hierarchy-edit.custom.OPExtend.enableCreate\"\n>      }\n> }\n> ```\n\n  \n  \n**Custom Create Mode Options in the Tree Table**\n\n![](images/Create_button_in_tree_table_46b2fb1.png \"Custom Create Mode Options in the Tree Table\")\n\n\n\n### Custom Create Mode with a Create Dialog\n\nSet up a create dialog as shown in the following example:\n\n> ### Sample Code:  \n> ```json\n> \"tableSettings\": {\n>     \"type\": \"TreeTable\",\n>     \"hierarchyQualifier\": \"NodesHierarchy\",\n>     \"personalization\": true,\n>     \"creationMode\": {\n>         \"name\": \"CreationDialog\",\n>         \"creationFields\": \"Title\",\n>         \"nodeType\": {\n>             \"propertyName\": \"nodeType\",\n>             \"values\": {\n>                 \"Zone\": \"Create a new Zone\",\n>                 \"Intermediary\": {\n>                     \"label\": \"Create a new Intermediary node\",\n>                     \"creationFields\": \"Category\",},\n>                 \"Line\": \"Create a new Line item\"\n>             }\n>         },\n>         \"isCreateEnabled\": \".extension.hierarchy-edit.custom.OPExtend.enableCreate\"\n>     }\n> }\n> ```\n\nIn this example, the create dialog is displayed with the property `Title` for the node types `Zone` and `Line`, and the property `Category` for the node type `Intermediary`.\n\n\n\n### Enabling or Disabling the Create Button or the Create Menu Button\n\nFor both the standard create mode and the custom create mode, you can define an `isCreateEnabled` extension point to control whether the *Create* button or *Create Menu* buttons are enabled or disabled. The extension point callback needs to be added to the page controller extension.\n\nThe following parameters are provided to the callback:\n\n-   The `value` associated with the selected menu item.\n\n    If the standard create mode is used, the `value` is `null`.\n\n-   The `parent context` of the parent under which the new node is created.\n\n    If no node is selected \\(creation at the root level of the hierarchy\\), the `parent context` is `undefined`.\n\n\n> ### Sample Code:  \n> `manifest.json`\n> \n> ```json\n> sap.ui.define([\"sap/ui/core/mvc/ControllerExtension\"], function (ControllerExtension) {\n>     \"use strict\";\n>  \n>     return ControllerExtension.extend(\"hierarchy-edit.custom.OPExtend\", {\n>         // this section allows to extend lifecycle hooks or override public methods of the base controller\n>  \n>         //Callback to enable Create actions\n>         enableCreate: function (value, parentContext) {\n>             switch (parentContext?.getProperty(\"nodeType\")) {\n>                 case \"Zone\":\n>                     return value !== \"Zone\"; // Anything but 'Zone' under 'Zone'\n>  \n>                 case \"Intermediary\":\n>                     return value === \"Line\"; // Only 'Line' under 'Intermediary'\n>  \n>                 case \"Line\":\n>                     return false; // Nothing under 'Line'\n>  \n>                 default:\n>                     return value === \"Zone\"; // Only 'Zone' at root level\n>             }\n>         }\n>     }\n> }\n> ```\n\nThe following screenshot shows an example of the outcome. Under an \"Intermediary\" parent, only a \"Line\" node type can be created.\n\n  \n  \n**Disabled Create Menu Buttons**\n\n![](images/Create_button_intermediary_to_line_node_only_cb60cdd.png \"Disabled Create Menu Buttons\")\n\n\n\n<a name=\"loio7cf7a31fd1ee490ab816ecd941bd2f1f__section_ak5_szn_tbc\"/>\n\n## Create at a Position Calculated by the Back-End Server\n\nBy default, a newly created node is always displayed as the first child below its parent even if a sort or a filter is applied to the table.\n\nYou can use the `createInPlace` option to place the new node in its real position below its parent, which depends on the sort criteria applied to the table and the back-end server logic. If the new node cannot be visualized due to the filter criteria applied to the table, a message toast is displayed to the end user.\n\n> ### Note:  \n> In the flexible column layout, when using both the `NewPage` and `createInPlace` options of the `createMode` property, the new entry is shown \\(for example, in a subobject page\\), but no message toast is displayed if it cannot be shown on the object page due to the applied filter criteria.\n\n> ### Sample Code:  \n> `manifest.json`\n> \n> ```json\n> \"tableSettings\": {\n>     \"type\": \"TreeTable\",\n>     \"hierarchyQualifier\": \"NodesHierarchy\",\n>     \"personalization\": true,\n>     \"creationMode\": {\n>         \"name\": \"Inline\",\n>         \"createInPlace\": true,\n>         \"nodeType\": {\n>             \"propertyName\": \"nodeType\",\n>             \"values\": {\n>                 \"Zone\": \"Create a new Zone\",\n>                 \"Intermediary\": \"Create a new Intermediary node\",\n>                 \"Line\": \"Create a new Line item\"\n>             }\n>         },\n>         \"isCreateEnabled\": \".extension.hierarchy-edit.custom.OPExtend.enableCreate\"\n>     }\n> }\n> ```\n\n\n\n<a name=\"loio7cf7a31fd1ee490ab816ecd941bd2f1f__section_qkl_rms_gbc\"/>\n\n## Drag and Drop\n\nDrag and drop actions are supported by SAP Fiori elements for OData V4 as of SAPUI5 1.124.\n\nDrag and drop between siblings is supported if the `ChangeNextSiblingAction` term is defined in the `RecursiveHierarchyActions` annotation. When using the ABAP RESTful Application Programming Model \\(RAP\\), this annotation is not set for root entities. For this reason, drag and drop between siblings is not supported in the list report.\n\nIf a node is dropped onto the empty area on the right-hand side of a table, the node is promoted to a root node. In the following example, dropping the \"Canada\" node onto the highlighted area turns it into a root node, that is, a sibling to the \"Europe North\" and \"America North\" nodes.\n\n  \n  \n**Dropping a Node onto the Empty Right-Hand Side of a Table**\n\n![](images/Dropping_a_Node_onto_the_Empty_Right-Hand_Side_of_a_Table_d74fc6f.png \"Dropping a Node onto the Empty Right-Hand Side of a Table\")\n\nYou can use the following extensions to control the behavior of drag and drop:\n\n-   `isMoveToPositionAllowed`: Define if a source node can be dropped on a specific parent node.\n\n    -   The associated callback receives the source and target contexts as parameters.\n\n    -   When dropping as a root node, the parent node is set to `null`.\n\n-   `isNodeMovable`: Define if a node can be dragged.\n\n    -   The associated callback receives the source context as a parameter.\n\n\n\nIn the following example: drag and drop is enabled.\n\n> ### Sample Code:  \n> `manifest.json`\n> \n> ```json\n> \"tableSettings\": {\n>     \"type\": \"TreeTable\",\n>     \"hierarchyQualifier\": \"NodesHierarchy\",\n>     \"personalization\": true,\n>     \"creationMode\": {...},\n>     \"isMoveToPositionAllowed\": \".extension.hierarchy-edit.custom.OPExtend.moveToPositionAllowed\",\n>     \"isNodeMovable\": \".extension.hierarchy-edit.custom.OPExtend.nodeMovable\"\n> }\n> ```\n\nIn the following example: `ControllerExtension` is used to control the behavior of drag and drop.\n\n> ### Sample Code:  \n> `manifest.json`\n> \n> ```json\n> sap.ui.define([\"sap/ui/core/mvc/ControllerExtension\"], function (ControllerExtension) {\n>     \"use strict\";\n>  \n>     return ControllerExtension.extend(\"hierarchy-edit.custom.OPExtend\", {\n>         // this section allows to extend lifecycle hooks or override public methods of the base controller\n>  \n>         //Callback for Drop and Paste actions\n>         moveToPositionAllowed: function (sourceContext, parentContext) {\n>             switch (parentContext?.getProperty(\"nodeType\")) {\n>                 case \"Zone\":\n>                     return sourceContext?.getProperty(\"nodeType\") === \"Intermediary\"; //Only 'Intermediary' under a 'Zone'\n>  \n>                 case \"Intermediary\":\n>                     return  sourceContext?.getProperty(\"nodeType\") === \"Line\" && sourceContext?.getProperty(\"name\") !== 'Dublin'; // Only 'Line' under 'Intermediary' AND 'Dublin' node cannot be moved\n>  \n>                 case \"Line\":\n>                     return false; // Nothing under 'Line'\n>  \n>                 default:\n>                     return false;\n>             }\n>         },\n>  \n>         //Callback for Drag and Cut actions\n>         nodeMovable: function (sourceContext) {\n>             return sourceContext?.getProperty(\"name\") !== 'USA'; // 'USA' node cannot be moved or cut\n>         }\n>     });\n> });\n> ```\n\nThe following screenshot shows an example of the outcome. The end user can drag and drop the \"Japan\" node under \"Asia\".\n\n  \n  \n**Example of Dropping a Node Under a Parent Node**\n\n![](images/Example_of_dropping_a_node_under_a_parent_a13261e.png \"Example of Dropping a Node Under a Parent Node\")\n\nThe following screenshot shows another example of the outcome. Moving the \"Dublin\" node is forbidden, so the target node is not highlighted.\n\n  \n  \n**Example of a Forbidden Move**\n\n![](images/Example_of_a_forbidden_move_51a0bee.png \"Example of a Forbidden Move\")\n\n\n\n<a name=\"loio7cf7a31fd1ee490ab816ecd941bd2f1f__section_u4g_lrt_vbc\"/>\n\n## Move Up and Move Down\n\nEnd users can move a node up or down between its siblings in a tree table. To place a node before its previous sibling or after its next sibling, select the node and choose *Move Up* or *Move Down* from the tree table toolbar.\n\nMoving a node up or down is supported if the `ChangeNextSiblingAction` term is defined in the `RecursiveHierarchyActions` annotation. When using the ABAP RESTful Application Programming Model \\(RAP\\), this annotation is not set for root entities. For this reason, moving up or down a node is not supported in the list report.\n\n> ### Restriction:  \n> A node that is created without the `createInPlace` option is displayed as the first child below its parent and is therefore considered \"out of place\". Move operations are disabled for such nodes. Similarly, moving a node up is disabled if its previous sibling is an \"out of place\" node.\n> \n> Moving a node up and down is also disabled in the following situations:\n> \n> -   A sort is applied to the table.\n> \n> -   The `isNodeMovable` or `isMoveToPositionAllowed` extension points return `false` \\(see the previous section, [Drag and Drop](tree-tables-7cf7a31.md#loio7cf7a31fd1ee490ab816ecd941bd2f1f__section_qkl_rms_gbc)\\).\n\n\n\n<a name=\"loio7cf7a31fd1ee490ab816ecd941bd2f1f__section_nl2_r1y_gbc\"/>\n\n## Cut and Paste\n\nCut and paste actions are supported by SAP Fiori elements for OData V4 as of SAPUI5 1.124.\n\nBoth actions can be enabled or disabled by using the same extension points as for drag and drop:\n\n-   `isNodeMovable`: Defines if a node can be cut.\n\n-   `isMoveToPositionAllowed`: Defines if a node can be pasted under a specific parent node.\n\n\nIn the following example, the USA node can't be cut or dragged:\n\n  \n  \n**Example of a Node with Disabled Cut Action**\n\n![](images/Example_of_a_node_with_disabled_cut_action_6478e27.png \"Example of a Node with Disabled Cut Action\")\n\n> ### Note:  \n> When pasting, the position of the pasted node under its parent is defined by the back-end logic, which should reflect the needs of your use case.\n\n\n\n<a name=\"loio7cf7a31fd1ee490ab816ecd941bd2f1f__section_gms_4s5_2fc\"/>\n\n## Copy and Paste\n\nCopying a node is supported by SAP Fiori elements for OData V4 as of SAPUI5 1.136. It can be enabled or disabled by using the following extension points:\n\n-   `isNodeCopyable`: Defines if a node can be copied. The associated callback receives the source context as a parameter.\n-   `isCopyToPositionAllowed`: Defines if a source node can be pasted under a specific parent node. The associated callback receives the source and target contexts as parameters.\n\n> ### Sample Code:  \n> `manifest.json`\n> \n> ```json\n> \"tableSettings\": {\n>     \"type\": \"TreeTable\",\n>     \"hierarchyQualifier\": \"NodesHierarchy\",\n>     \"personalization\": true,\n>     \"creationMode\": {...},\n>     \"isNodeCopyable\": \".extension.hierarchy-edit.custom.OPExtend.enableCopy\",\n> \t\"isCopyToPositionAllowed\": \".extension.hierarchy-edit.custom.OPExtend.enablePasteFromCopy\"\n> }\n> ```\n\n\n\n<a name=\"loio7cf7a31fd1ee490ab816ecd941bd2f1f__section_zvl_zyn_jdc\"/>\n\n## Context Menu\n\nYou can open the context menu in the tree table by right-clicking on any node within the table. All the other nodes are greyed out. Only bound actions are included in this menu.\n\n> ### Note:  \n> Actions that are specific to tree tables, such as cut, paste, expand entire node, or collapse entire node, are not supported with multi-selection.\n\n\n\n<a name=\"loio7cf7a31fd1ee490ab816ecd941bd2f1f__section_u3q_5fy_gbc\"/>\n\n## Disabling Hierarchy Change Operations\n\nYou can disable drag and drop as well as cut and paste to restrict changes in the hierarchy. To do that, use the `UpdateRestrictions` and `NonUpdatableNavigationProperties` annotations on the navigation property to the hierarchy parent.\n\n> ### Sample Code:  \n> `manifest.json`\n> \n> ```json\n> @odata.draft.enabled\n>   entity TreeTableSubEntityWithUpdateRestriction {\n>         @Core.Immutable: true\n>         @Common.Label  : 'ID'\n>     key ID               : String;\n>         parent           : String;\n>  \n>         @Common.Label  : 'Org level name'\n>         name             : String;\n>  \n>         @UI.Hidden     : true\n>         orgID            : String;\n>  \n>         @Core.Computed : true\n>         @UI.Hidden     : true\n>         DistanceFromRoot : Integer64;\n>  \n>         Superordinate    : Association to TreeTableSubEntityWithUpdateRestriction\n>                              on Superordinate.ID = parent;\n>         Organization     : Association to TreeTableEntity\n>                              on Organization.ID = orgID;\n>   }\n>  \n>   annotate TreeTableSubEntityWithUpdateRestriction with @(Capabilities: {UpdateRestrictions: {NonUpdatableNavigationProperties: [Superordinate]}});\n> ```\n\n\n\n<a name=\"loio7cf7a31fd1ee490ab816ecd941bd2f1f__section_lyz_f3w_rcc\"/>\n\n## Disabling the Reordering of Root Nodes\n\nYou can prevent users from changing the order of root nodes by using the [`ChangeSiblingForRootsSupported`](https://github.com/SAP/odata-vocabularies/blob/main/vocabularies/Hierarchy.xml#L201) annotation.\n\nIf `ChangeSiblingForRootsSupported` is set to `false`, users can't do the following actions:\n\n-   Move a root node up or down\n\n-   Drop a node as a root node between two other root nodes\n\n\nIf no specific restrictions have been set for an action, the following actions are supported:\n\n-   Cutting a root node\n\n-   Pasting a node as a root node\n\n-   Dragging a root node\n\n-   Dropping a node as a root node at the beginning or end of the table or onto the right-hand side of the table\n\n\nIf `ChangeSiblingForRootsSupported` is not defined, it is considered as set to `true`.\n\n> ### Sample Code:  \n> XML Annotation\n> \n> ```xml\n> <edmx:Reference Uri=\"/sap/opu/odata/IWFND/CATALOGSERVICE;v=2/Vocabularies(TechnicalName='%2FIWBEP%2FVOC_HIERARCHY',Version='0001',SAP__Origin='LOCAL')/$value\">\n>   <edmx:Include Namespace=\"com.sap.vocabularies.Hierarchy.v1\" Alias=\"SAP__hierarchy\"/>\n> </edmx:Reference>\n> \n> <Annotations Target=\"SAP__self.HierarchyEntityType\">\n>   <Annotation Term=\"SAP__hierarchy.RecursiveHierarchyActions\" Qualifier=\"HierarchyNode\">\n>     <Record>\n>       <PropertyValue Property=\"ChangeNextSiblingAction\" String=\"SAP__self.changeNextSibling\"/>\n>       <PropertyValue Property=\"CopyAction\" String=\"SAP__self.copy\"/>\n>       <PropertyValue Property=\"ChangeSiblingForRootsSupported\" Bool=\"false\"/>\n>     </Record>\n>   </Annotation>\n> </Annotations>\n> ```\n\n\n\n<a name=\"loio7cf7a31fd1ee490ab816ecd941bd2f1f__section_vf1_cly_gbc\"/>\n\n## `TreeTable` Building Block\n\nYou can use a dedicated `TreeTable` building block in SAP Fiori elements for OData V4.\n\n-   For more information about this building block, see the [API reference](https://ui5.sap.com/#/api/sap.fe.macros.TreeTable).\n\n-   You can also check out our live example in the flexible programming model explorer at [Table - Tree Table](https://ui5.sap.com/test-resources/sap/fe/core/fpmExplorer/index.html#/buildingBlocks/table/treeTable).\n\n\n",
  "excerpt": "<!-- loio7cf7a31fd1ee490ab816ecd941bd2f1f --> Tree Tables You can use tree tables in the list report and the object page. > Note:   > This topic is only applicable to SAP Fiori elements for OData V4. ...",
  "wordCount": 2519,
  "version": "1.0.0",
  "source": "sapui5",
  "sourceType": "github"
}